{
  "manifestVersion": "1.0",
  "key": "spark-x-agent",
  "name": "星火 Agent",
  "version": "0.17.0",
  "protocolVersion": "1.0",
  "platformRange": ">=0.1.0 <0.2.0",
  "environmentSchema": {
    "type": "object",
    "additionalProperties": false,
    "required": ["baseUrl"],
    "properties": {
      "baseUrl": {
        "type": "string",
        "format": "uri"
      }
    }
  },
  "capabilities": {
    "actions": [
      {
        "key": "conversation.create",
        "name": "创建会话",
        "description": "使用受控登录凭据创建带运行标识的星火 Agent 会话。",
        "actionLevel": "write",
        "defaultTimeoutMs": 20000,
        "producesResource": true,
        "cleanupAction": "conversation.delete",
        "inputSchema": {
          "type": "object",
          "additionalProperties": false,
          "required": ["username", "password", "title"],
          "properties": {
            "username": { "type": "string", "minLength": 1, "maxLength": 200 },
            "password": { "type": "string", "minLength": 1, "maxLength": 4096 },
            "title": { "type": "string", "minLength": 1, "maxLength": 200 }
          }
        },
        "outputSchema": {
          "type": "object",
          "additionalProperties": false,
          "required": ["conversationId", "title"],
          "properties": {
            "conversationId": { "type": "string", "format": "uuid" },
            "title": { "type": "string" }
          }
        }
      },
      {
        "key": "conversation.assert-recent",
        "name": "校验最近会话",
        "description": "验证会话出现在最近列表的首个非置顶位置，并用历史接口核对消息数。",
        "actionLevel": "write",
        "defaultTimeoutMs": 20000,
        "producesResource": false,
        "inputSchema": {
          "type": "object",
          "additionalProperties": false,
          "required": ["username", "password", "conversationId", "title"],
          "properties": {
            "username": { "type": "string", "minLength": 1, "maxLength": 200 },
            "password": { "type": "string", "minLength": 1, "maxLength": 4096 },
            "conversationId": { "type": "string", "format": "uuid" },
            "title": { "type": "string", "minLength": 1, "maxLength": 200 },
            "expectedMessageCount": { "type": "integer", "minimum": 0, "maximum": 99 }
          }
        },
        "outputSchema": {
          "type": "object",
          "additionalProperties": false,
          "required": [
            "conversationId",
            "listed",
            "occurrenceCount",
            "recentPosition",
            "messageCount",
            "messageCountSource"
          ],
          "properties": {
            "conversationId": { "type": "string", "format": "uuid" },
            "listed": { "const": true },
            "occurrenceCount": { "const": 1 },
            "recentPosition": { "type": "integer", "minimum": 0 },
            "messageCount": { "type": "integer", "minimum": 0 },
            "messageCountSource": { "const": "conversation-history" }
          }
        }
      },
      {
        "key": "conversation.rename-and-assert-pagination",
        "name": "重命名并校验会话分页",
        "description": "重命名一个已登记会话，并以每页两条连续扫描两次最近会话，验证跨页无重复、遗漏和顺序漂移。",
        "actionLevel": "write",
        "defaultTimeoutMs": 30000,
        "producesResource": false,
        "inputSchema": {
          "type": "object",
          "additionalProperties": false,
          "required": ["username", "password", "conversationId", "title", "expectedOrder"],
          "properties": {
            "username": { "type": "string", "minLength": 1, "maxLength": 200 },
            "password": { "type": "string", "minLength": 1, "maxLength": 4096 },
            "conversationId": { "type": "string", "format": "uuid" },
            "title": { "type": "string", "minLength": 1, "maxLength": 200 },
            "expectedOrder": {
              "type": "array",
              "minItems": 3,
              "maxItems": 3,
              "uniqueItems": true,
              "items": { "type": "string", "format": "uuid" }
            }
          }
        },
        "outputSchema": {
          "type": "object",
          "additionalProperties": false,
          "required": [
            "conversationId",
            "renamed",
            "titleSource",
            "titleSha256",
            "pageSize",
            "expectedConversationCount",
            "firstSweepPages",
            "secondSweepPages",
            "distinctExpectedPages",
            "duplicateCount",
            "missingCount",
            "crossPage",
            "orderStable"
          ],
          "properties": {
            "conversationId": { "type": "string", "format": "uuid" },
            "renamed": { "const": true },
            "titleSource": { "const": "manual" },
            "titleSha256": { "type": "string", "minLength": 64, "maxLength": 64 },
            "pageSize": { "const": 2 },
            "expectedConversationCount": { "const": 3 },
            "firstSweepPages": { "type": "integer", "minimum": 2, "maximum": 100 },
            "secondSweepPages": { "type": "integer", "minimum": 2, "maximum": 100 },
            "distinctExpectedPages": { "type": "integer", "minimum": 2, "maximum": 3 },
            "duplicateCount": { "const": 0 },
            "missingCount": { "const": 0 },
            "crossPage": { "const": true },
            "orderStable": { "const": true }
          }
        }
      },
      {
        "key": "conversation.assert-deleted-state",
        "name": "校验会话删除状态",
        "description": "验证已删除会话不再出现在活动列表、删除列表中恰好保留一条，并只暴露删除态结构化证据。",
        "actionLevel": "read",
        "defaultTimeoutMs": 20000,
        "producesResource": false,
        "inputSchema": {
          "type": "object",
          "additionalProperties": false,
          "required": ["username", "password", "conversationId"],
          "properties": {
            "username": { "type": "string", "minLength": 1, "maxLength": 200 },
            "password": { "type": "string", "minLength": 1, "maxLength": 4096 },
            "conversationId": { "type": "string", "format": "uuid" }
          }
        },
        "outputSchema": {
          "type": "object",
          "additionalProperties": false,
          "required": [
            "conversationId",
            "detailState",
            "activeOccurrences",
            "deletedOccurrences",
            "activePagesScanned",
            "deletedPagesScanned",
            "uniqueDeletedRecord"
          ],
          "properties": {
            "conversationId": { "type": "string", "format": "uuid" },
            "detailState": { "enum": ["deleted", "missing"] },
            "activeOccurrences": { "const": 0 },
            "deletedOccurrences": { "const": 1 },
            "activePagesScanned": { "type": "integer", "minimum": 1, "maximum": 10 },
            "deletedPagesScanned": { "type": "integer", "minimum": 1, "maximum": 10 },
            "uniqueDeletedRecord": { "const": true }
          }
        }
      },
      {
        "key": "chat.ask",
        "name": "发送对话并校验回复",
        "description": "向已登记测试会话发送带运行标识的受控消息，并校验完整 SSE 回复。",
        "actionLevel": "write",
        "defaultTimeoutMs": 120000,
        "producesResource": false,
        "inputSchema": {
          "type": "object",
          "additionalProperties": false,
          "required": ["username", "password", "conversationId", "message", "expectedText"],
          "properties": {
            "username": { "type": "string", "minLength": 1, "maxLength": 200 },
            "password": { "type": "string", "minLength": 1, "maxLength": 4096 },
            "conversationId": { "type": "string", "format": "uuid" },
            "message": { "type": "string", "minLength": 1, "maxLength": 20000 },
            "expectedText": {
              "type": "string",
              "minLength": 1,
              "maxLength": 5000
            }
          }
        },
        "outputSchema": {
          "type": "object",
          "additionalProperties": false,
          "required": [
            "conversationId",
            "done",
            "expectedTextMatched",
            "contentEventCount",
            "statusEventCount",
            "assistantPreviewEventCount",
            "toolEventCount",
            "skillEventCount",
            "reviewEventCount",
            "streamBytes",
            "streamedContentLength",
            "finalContentLength",
            "finalContentSha256",
            "truncated"
          ],
          "properties": {
            "conversationId": { "type": "string", "format": "uuid" },
            "done": { "const": true },
            "expectedTextMatched": { "const": true },
            "contentEventCount": { "type": "integer", "minimum": 1 },
            "statusEventCount": { "type": "integer", "minimum": 0 },
            "assistantPreviewEventCount": { "type": "integer", "minimum": 0 },
            "toolEventCount": { "type": "integer", "minimum": 0 },
            "skillEventCount": { "type": "integer", "minimum": 0 },
            "reviewEventCount": { "type": "integer", "minimum": 0 },
            "streamBytes": {
              "type": "integer",
              "minimum": 1,
              "maximum": 1000000
            },
            "streamedContentLength": { "type": "integer", "minimum": 1 },
            "finalContentLength": { "type": "integer", "minimum": 1 },
            "finalContentSha256": {
              "type": "string",
              "minLength": 64,
              "maxLength": 64
            },
            "truncated": { "const": false },
            "stopReason": { "type": "string" },
            "durationMs": { "type": "number", "minimum": 0 }
          }
        }
      },
      {
        "key": "chat.cancel-and-resume",
        "name": "取消生成并续接会话",
        "description": "通过受控 Turn 队列启动长回答，在 active 状态请求取消，确认无幽灵助手消息后用同一会话完成下一轮。",
        "actionLevel": "write",
        "defaultTimeoutMs": 180000,
        "producesResource": false,
        "inputSchema": {